{
  "$schema": "https://json-schema.org/draft/2020-12/schema",
  "$id": "https://helixos.dev/schemas/eln/workspace.schema.json",
  "title": "Workspace",
  "type": "object",
  "required": ["organization_id", "name", "category", "subcategory", "description", "id", "is_default", "created_at", "updated_at"],
  "properties": {
    "id": { "type": "string" },
    "organization_id": { "type": "string" },
    "name": { "type": "string", "minLength": 1 },
    "category": {
      "type": "string",
      "enum": [
        "molecular_biology",
        "biochemistry",
        "microbiology",
        "next_gen_sequencing",
        "digital_pathology",
        "programmable_bio",
        "genomics",
        "cell_biology",
        "custom"
      ]
    },
    "subcategory": {
      "type": ["string", "null"],
      "maxLength": 64,
      "description": "Optional refinement of the category (e.g. DNA/RNA/Protein for next_gen_sequencing). Free string; suggested values are advisory."
    },
    "description": { "type": ["string", "null"] },
    "is_default": { "type": "boolean" },
    "created_at": { "type": "string", "format": "date-time" },
    "updated_at": { "type": "string", "format": "date-time" }
  }
}
