{
  "id": "ws_demo_molbio",
  "organization_id": "org_demo",
  "name": "Molecular Biology",
  "category": "molecular_biology",
  "subcategory": null,
  "description": "Cloning, PCR and assembly work.",
  "is_default": true,
  "created_at": "2026-05-10T00:00:00Z",
  "updated_at": "2026-05-10T00:00:00Z"
}
